{
  "schema_version": 1,
  "suite": "demo-architecture",
  "projects": {
    "subject": {"config": "archbird.json"}
  },
  "extractors": {
    "required.core_api": {
      "kind": "literal_set",
      "values": ["demo_close", "demo_open"]
    },
    "actual.core_api": {
      "kind": "symbols",
      "project": "subject",
      "layer": "core",
      "paths": ["include/demo.h"],
      "public_only": true
    }
  },
  "checks": [
    {
      "id": "CORE-PUBLIC-API",
      "assert": "required_subset",
      "expected": "required.core_api",
      "actual": "actual.core_api",
      "severity": "error",
      "owner": "core",
      "rationale": "Supported native entrypoints must remain public."
    }
  ]
}
